<?xml version="1.0" encoding="UTF-8"?>
<storico_cre xmlns:xsi="http://www.w3.org/2001/XMLSchema-instance" xsi:noNamespaceSchemaLocation="storico_cre.xsd">
  <richiesta>
    <id>1</id>
    <id_utente>14</id_utente>
    <nome>Mario</nome>
    <cognome>Rossi</cognome>
    <qnt>23</qnt>
  </richiesta>
  <richiesta>
    <id>2</id>
    <id_utente>15</id_utente>
    <nome>Luca</nome>
    <cognome>Verdi</cognome>
    <qnt>44</qnt>
  </richiesta>
  <richiesta>
    <id>3</id>
    <id_utente>16</id_utente>
    <nome>Luigi</nome>
    <cognome>Lucio</cognome>
    <qnt>120</qnt>
  </richiesta>
</storico_cre>
